{
  "v": 1,
  "description": "Synthetic candidate typed-effect bytes and genuine low-S enrolled-point signatures. These fixtures establish no original enrollment, retained grant, current actor, durable platform closure, server acceptance or radio permission. Opposed outcomes are independent codec cases, not accepted state transitions.",
  "enrolled_point": "BFwZcp-3sjLNTEWcf7w77lIy_LsIv7wWkG4xAZme6_vDq8KcYeQiTdtknNgLxL-v5mvXi4Q0YsP9opMMPPv22Ec",
  "enrolled_key_id": "H9UjVFR8cOhcPTlZ_5cZk7Odf-IM0g3lS62gpfAn0_4",
  "cases": [
    {
      "ids": {
        "account_id": "00000000-0000-0000-0000-0000000003e9",
        "device_id": "00000000-0000-0000-0000-0000000003ea",
        "event_id": "00000000-0000-0000-0000-0000000003eb",
        "message_id": "00000000-0000-0000-0000-0000000003ec",
        "attempt_id": "00000000-0000-0000-0000-0000000003ed",
        "closure_id": "00000000-0000-0000-0000-0000000003ee",
        "proof_request_id": "00000000-0000-0000-0000-0000000003ef",
        "challenge_id": "00000000-0000-0000-0000-0000000003f0"
      },
      "numbers": [
        "11",
        "2",
        "12",
        "2",
        "1",
        "1",
        "3000000",
        "3000500",
        "3001000",
        "3031000"
      ],
      "closed_from": 0,
      "nonce": "8um5BKOxQZfAfO9Fh59cjReQ_h2r55GGsSJKJlsiFMs",
      "digests": [
        "2zHu-DNMr5q1aoMkx4JjQ5Ehvhs3BGKOnDmIgaRaxWE",
        "Yi4ElELo8xWAGT6GEB-6VDJ0tgl_wzy5lJyGi7iRk9U",
        "6UBJlPD8RSh53WQTOy0FaLztI-YTYnV0KwgwKMzBc0k",
        "Ui30fk2mWtRvsVvLPd0oMg0D6UnRnIywMADmD-ASCMU",
        "H9UjVFR8cOhcPTlZ_5cZk7Odf-IM0g3lS62gpfAn0_4",
        "1LJQzJPPz7OB1DJqENPB-SmnyfrsBtI4qsHXXI7xLPo",
        "_UnAreYEXikPkhXHZK0m9HHwPm2P5heLZl74fEplBBg"
      ],
      "submit": "AAAAAAAAAAAAAAAAAAAD6QAAAAAAAAAAAAAAAAAAA-oAAAAAAAAAAAAAAAAAAAPrAAAAAAAAAAAAAAAAAAAD7AAAAAAAAAAAAAAAAAAAA-3bMe74M0yvmrVqgyTHgmNDkSG-GzcEYo6cOYiBpFrFYelASZTw_EUoed1kEzstBWi87SPmE2J1dCsIMCjMwXNJAQAAAAAALcbA",
      "submit_commitment": "Yi4ElELo8xWAGT6GEB-6VDJ0tgl_wzy5lJyGi7iRk9U",
      "closure_record": "AAAAAAAAAAAAAAAAAAAD6QAAAAAAAAAAAAAAAAAAA-oAAAAAAAAAAAAAAAAAAAPrAAAAAAAAAAAAAAAAAAAD7AAAAAAAAAAAAAAAAAAAA-0AAAAAAAAAAAAAAAAAAAPu2zHu-DNMr5q1aoMkx4JjQ5Ehvhs3BGKOnDmIgaRaxWFiLgSUQujzFYAZPoYQH7pUMnS2CX_DPLmUnIaLuJGT1elASZTw_EUoed1kEzstBWi87SPmE2J1dCsIMCjMwXNJAQAAAAAALcbAAAAAAAAALci0",
      "closure_commitment": "_UnAreYEXikPkhXHZK0m9HHwPm2P5heLZl74fEplBBg",
      "core": "WlROUwEDAwAAAAAAAAAAAAAAAAAAAAPpAAAAAAAAAAAAAAAAAAAD6gAAAAAAAAAAAAAAAAAAA-sAAAAAAAAAAAAAAAAAAAPsAAAAAAAAAAAAAAAAAAAD7QAAAAAAAAAAAAAAAAAAA-4AAAAAAAAAAAAAAAAAAAPvAAAAAAAAAAAAAAAAAAAD8AAAAAAAAAALAAAAAAAAAAIAAAAAAAAADAAAAAAAAAACAAAAAAAAAAEAAAAAAAAAAQAAAAAALcbAAAAAAAAtyLQAAAAAAC3KqAAAAAAALj_Y2zHu-DNMr5q1aoMkx4JjQ5Ehvhs3BGKOnDmIgaRaxWFiLgSUQujzFYAZPoYQH7pUMnS2CX_DPLmUnIaLuJGT1elASZTw_EUoed1kEzstBWi87SPmE2J1dCsIMCjMwXNJUi30fk2mWtRvsVvLPd0oMg0D6UnRnIywMADmD-ASCMUf1SNUVHxw6Fw9OVn_lxmTs51_4gzSDeVLraCl8CfT_tSyUMyTz8-zgdQyahDTwfkpp8n67AbSOKrB11yO8Sz6_UnAreYEXikPkhXHZK0m9HHwPm2P5heLZl74fEplBBgA",
      "core_sha256": "ncCGoDotU9S3SmYxxQv-hmjfFu9YrK1izGKwfK_SwoQ",
      "signature": "TMruGJkZB8rULRg5fh7GM9wL6F3enXiG14nOMNWskss7tzGkxa_UuUeVaPh0cITO8hUnAvynpsYOQdCY8aHyuQ",
      "outcomes": [
        {
          "event_id": "00000000-0000-0000-0000-000000002711",
          "evidence": 0,
          "segment_index": 0,
          "observed_ms": "3000501",
          "command": "AAAAAAAAAAAAAAAAAAAD6QAAAAAAAAAAAAAAAAAAA-oAAAAAAAAAAAAAAAAAACcRAAAAAAAAAAAAAAAAAAAD7AAAAAAAAAAAAAAAAAAAA-0AAAAAAAAAAAAAAAAAAAPrYi4ElELo8xWAGT6GEB-6VDJ0tgl_wzy5lJyGi7iRk9XbMe74M0yvmrVqgyTHgmNDkSG-GzcEYo6cOYiBpFrFYelASZTw_EUoed1kEzstBWi87SPmE2J1dCsIMCjMwXNJAAAAAAAtxsABAAAAAAAALci1AA",
          "commitment": "eKXgPGTDe7KBU4QvHdolJD_Q39vTIB13WZ-4Gu5ThPk"
        },
        {
          "event_id": "00000000-0000-0000-0000-000000002712",
          "evidence": 1,
          "segment_index": 0,
          "observed_ms": "3000502",
          "command": "AAAAAAAAAAAAAAAAAAAD6QAAAAAAAAAAAAAAAAAAA-oAAAAAAAAAAAAAAAAAACcSAAAAAAAAAAAAAAAAAAAD7AAAAAAAAAAAAAAAAAAAA-0AAAAAAAAAAAAAAAAAAAPrYi4ElELo8xWAGT6GEB-6VDJ0tgl_wzy5lJyGi7iRk9XbMe74M0yvmrVqgyTHgmNDkSG-GzcEYo6cOYiBpFrFYelASZTw_EUoed1kEzstBWi87SPmE2J1dCsIMCjMwXNJAAAAAAAtxsABAQAAAAAALci2AA",
          "commitment": "-emB4ra_6d663mqY8OOAnFg4M9_iscALxIut7py8-fw"
        },
        {
          "event_id": "00000000-0000-0000-0000-000000002713",
          "evidence": 2,
          "segment_index": null,
          "observed_ms": "3000503",
          "command": "AAAAAAAAAAAAAAAAAAAD6QAAAAAAAAAAAAAAAAAAA-oAAAAAAAAAAAAAAAAAACcTAAAAAAAAAAAAAAAAAAAD7AAAAAAAAAAAAAAAAAAAA-0AAAAAAAAAAAAAAAAAAAPrYi4ElELo8xWAGT6GEB-6VDJ0tgl_wzy5lJyGi7iRk9XbMe74M0yvmrVqgyTHgmNDkSG-GzcEYo6cOYiBpFrFYelASZTw_EUoed1kEzstBWi87SPmE2J1dCsIMCjMwXNJAAAAAAAtxsABAgAAAAAALci3_w",
          "commitment": "kyg0JKgNJsCUwjtPYi3O7FS0ItEU5QKXQMsnCQUAmKE"
        },
        {
          "event_id": "00000000-0000-0000-0000-000000002714",
          "evidence": 3,
          "segment_index": null,
          "observed_ms": "3000504",
          "command": "AAAAAAAAAAAAAAAAAAAD6QAAAAAAAAAAAAAAAAAAA-oAAAAAAAAAAAAAAAAAACcUAAAAAAAAAAAAAAAAAAAD7AAAAAAAAAAAAAAAAAAAA-0AAAAAAAAAAAAAAAAAAAPrYi4ElELo8xWAGT6GEB-6VDJ0tgl_wzy5lJyGi7iRk9XbMe74M0yvmrVqgyTHgmNDkSG-GzcEYo6cOYiBpFrFYelASZTw_EUoed1kEzstBWi87SPmE2J1dCsIMCjMwXNJAAAAAAAtxsABAwAAAAAALci4_w",
          "commitment": "0e0qqQNPx7YRwjXFQ60ZrMHHAjIH1H0D5gnrUgCQ65Y"
        },
        {
          "event_id": "00000000-0000-0000-0000-000000002715",
          "evidence": 4,
          "segment_index": null,
          "observed_ms": "3000505",
          "command": "AAAAAAAAAAAAAAAAAAAD6QAAAAAAAAAAAAAAAAAAA-oAAAAAAAAAAAAAAAAAACcVAAAAAAAAAAAAAAAAAAAD7AAAAAAAAAAAAAAAAAAAA-0AAAAAAAAAAAAAAAAAAAPrYi4ElELo8xWAGT6GEB-6VDJ0tgl_wzy5lJyGi7iRk9XbMe74M0yvmrVqgyTHgmNDkSG-GzcEYo6cOYiBpFrFYelASZTw_EUoed1kEzstBWi87SPmE2J1dCsIMCjMwXNJAAAAAAAtxsABBAAAAAAALci5_w",
          "commitment": "6qalDCUdRucwOdY-mdiaSHgKBYlvMAI1xNmF2lK9Qg0"
        },
        {
          "event_id": "00000000-0000-0000-0000-000000002716",
          "evidence": 5,
          "segment_index": null,
          "observed_ms": "3000506",
          "command": "AAAAAAAAAAAAAAAAAAAD6QAAAAAAAAAAAAAAAAAAA-oAAAAAAAAAAAAAAAAAACcWAAAAAAAAAAAAAAAAAAAD7AAAAAAAAAAAAAAAAAAAA-0AAAAAAAAAAAAAAAAAAAPrYi4ElELo8xWAGT6GEB-6VDJ0tgl_wzy5lJyGi7iRk9XbMe74M0yvmrVqgyTHgmNDkSG-GzcEYo6cOYiBpFrFYelASZTw_EUoed1kEzstBWi87SPmE2J1dCsIMCjMwXNJAAAAAAAtxsABBQAAAAAALci6_w",
          "commitment": "ZRHvHSu4--lbPhIuIeoi1RwlFBj6O8GrIn3TAHHNmms"
        }
      ]
    },
    {
      "ids": {
        "account_id": "00000000-0000-0000-0000-00000000044d",
        "device_id": "00000000-0000-0000-0000-00000000044e",
        "event_id": "00000000-0000-0000-0000-00000000044f",
        "message_id": "00000000-0000-0000-0000-000000000450",
        "attempt_id": "00000000-0000-0000-0000-000000000451",
        "closure_id": "00000000-0000-0000-0000-000000000452",
        "proof_request_id": "00000000-0000-0000-0000-000000000453",
        "challenge_id": "00000000-0000-0000-0000-000000000454"
      },
      "numbers": [
        "11",
        "2",
        "12",
        "2",
        "1",
        "6",
        "3000000",
        "3000500",
        "3001000",
        "3031000"
      ],
      "closed_from": 1,
      "nonce": "FmS5uM3wvW-LnJJbXncHWogCs3pVKZ6TO5dtIgTYQfo",
      "digests": [
        "Ns2ZUrpPLE2Ey4byO6q7fLfWv9kNsVBbHx7Uhw26NKs",
        "eElrgIqTP04lQ4CeS7jYbkUpR-tED2nIyZ4CZ2m92kM",
        "YbXtog7_fd7r6287q2FVX518EcyGt7ki-_7UxgCkE0Y",
        "u16AiihgL00NPOXsL8ka_N8vqSg687Rb0zqg4ZxlfGo",
        "H9UjVFR8cOhcPTlZ_5cZk7Odf-IM0g3lS62gpfAn0_4",
        "OEo7pGTKdlo4_WNPviiSh7Ry6B1jtjRRERpXo0oTibs",
        "E3VLJOhq3dAFpd2qV7ZUFHz4hJkGGk-9jZCFZPYXCug"
      ],
      "submit": "AAAAAAAAAAAAAAAAAAAETQAAAAAAAAAAAAAAAAAABE4AAAAAAAAAAAAAAAAAAARPAAAAAAAAAAAAAAAAAAAEUAAAAAAAAAAAAAAAAAAABFE2zZlSuk8sTYTLhvI7qrt8t9a_2Q2xUFsfHtSHDbo0q2G17aIO_33e6-tvO6thVV-dfBHMhre5Ivv-1MYApBNGBgAAAAAALcbA",
      "submit_commitment": "eElrgIqTP04lQ4CeS7jYbkUpR-tED2nIyZ4CZ2m92kM",
      "closure_record": "AAAAAAAAAAAAAAAAAAAETQAAAAAAAAAAAAAAAAAABE4AAAAAAAAAAAAAAAAAAARPAAAAAAAAAAAAAAAAAAAEUAAAAAAAAAAAAAAAAAAABFEAAAAAAAAAAAAAAAAAAARSNs2ZUrpPLE2Ey4byO6q7fLfWv9kNsVBbHx7Uhw26NKt4SWuAipM_TiVDgJ5LuNhuRSlH60QPacjJngJnab3aQ2G17aIO_33e6-tvO6thVV-dfBHMhre5Ivv-1MYApBNGBgAAAAAALcbAAQAAAAAALci0",
      "closure_commitment": "E3VLJOhq3dAFpd2qV7ZUFHz4hJkGGk-9jZCFZPYXCug",
      "core": "WlROUwEDAwAAAAAAAAAAAAAAAAAAAARNAAAAAAAAAAAAAAAAAAAETgAAAAAAAAAAAAAAAAAABE8AAAAAAAAAAAAAAAAAAARQAAAAAAAAAAAAAAAAAAAEUQAAAAAAAAAAAAAAAAAABFIAAAAAAAAAAAAAAAAAAARTAAAAAAAAAAAAAAAAAAAEVAAAAAAAAAALAAAAAAAAAAIAAAAAAAAADAAAAAAAAAACAAAAAAAAAAEAAAAAAAAABgAAAAAALcbAAAAAAAAtyLQAAAAAAC3KqAAAAAAALj_YNs2ZUrpPLE2Ey4byO6q7fLfWv9kNsVBbHx7Uhw26NKt4SWuAipM_TiVDgJ5LuNhuRSlH60QPacjJngJnab3aQ2G17aIO_33e6-tvO6thVV-dfBHMhre5Ivv-1MYApBNGu16AiihgL00NPOXsL8ka_N8vqSg687Rb0zqg4ZxlfGof1SNUVHxw6Fw9OVn_lxmTs51_4gzSDeVLraCl8CfT_jhKO6RkynZaOP1jT74okoe0cugdY7Y0UREaV6NKE4m7E3VLJOhq3dAFpd2qV7ZUFHz4hJkGGk-9jZCFZPYXCugB",
      "core_sha256": "1Siy3xuZnuv2KMIO1af9yFBEL_QVM3BxxuMQu9exTLs",
      "signature": "5f5GwZjVKzyrM3X13w6rgrUZErYoC_vmjfzbzf924HJCmJq_WTlOhlVhcBau1q_v6TsepQMFHHtOwWJ_kUWDjA",
      "outcomes": [
        {
          "event_id": "00000000-0000-0000-0000-000000002775",
          "evidence": 0,
          "segment_index": 0,
          "observed_ms": "3000501",
          "command": "AAAAAAAAAAAAAAAAAAAETQAAAAAAAAAAAAAAAAAABE4AAAAAAAAAAAAAAAAAACd1AAAAAAAAAAAAAAAAAAAEUAAAAAAAAAAAAAAAAAAABFEAAAAAAAAAAAAAAAAAAARPeElrgIqTP04lQ4CeS7jYbkUpR-tED2nIyZ4CZ2m92kM2zZlSuk8sTYTLhvI7qrt8t9a_2Q2xUFsfHtSHDbo0q2G17aIO_33e6-tvO6thVV-dfBHMhre5Ivv-1MYApBNGAAAAAAAtxsAGAAAAAAAALci1AA",
          "commitment": "EFOgtzm1uMenU6U0k_9gwBbC6NV0OioPC1Qd4p3lWrk"
        },
        {
          "event_id": "00000000-0000-0000-0000-000000002776",
          "evidence": 0,
          "segment_index": 1,
          "observed_ms": "3000502",